{
  "schemaVersion": "1.0.0",
  "projectId": "c2d4e6f8-0a1b-4c3d-9e5f-7a8b9c0d1e2f",
  "name": "完整工程",
  "createdAt": "2026-10-23T00:00:00.000Z",
  "updatedAt": "2026-10-23T01:40:00.000Z",
  "generator": {
    "app": "clipcut-web",
    "version": "1.0.0"
  },
  "settings": {
    "canvas": {
      "width": 1920,
      "height": 1080,
      "fps": 30,
      "aspectPreset": "16:9",
      "backgroundColor": "#000000"
    },
    "export": {
      "format": "mp4",
      "width": 1920,
      "height": 1080,
      "fps": 30,
      "videoBitrate": 8000000,
      "audioBitrate": 192000,
      "burnInSubtitle": true
    },
    "ai": {
      "routes": {
        "asr": "local-whisper",
        "audioDenoise": "onnx-web"
      },
      "providers": {
        "local-whisper": {
          "type": "local",
          "baseUrl": "http://localhost:8080",
          "model": "whisper-large-v3",
          "apiKey": null
        },
        "onnx-web": {
          "type": "webgpu",
          "baseUrl": null,
          "model": "silence-detector",
          "apiKey": null
        }
      }
    }
  },
  "assets": {
    "asset_full01": {
      "id": "asset_full01",
      "type": "video",
      "name": "beach.mp4",
      "sourceType": "local",
      "mimeType": "video/mp4",
      "sizeBytes": 10485760,
      "blobKey": "blob:asset_full01",
      "proxyBlobKey": null,
      "thumbnailBlobKey": "thumb:asset_full01",
      "waveform": null,
      "durationMs": 14000,
      "width": 1920,
      "height": 1080,
      "frameRate": 30,
      "hasAudio": true,
      "videoCodec": "avc1.640028",
      "playable": true,
      "license": null,
      "importedAt": "2026-10-23T00:00:00.000Z"
    },
    "asset_full02": {
      "id": "asset_full02",
      "type": "audio",
      "name": "music.mp3",
      "sourceType": "local",
      "mimeType": "audio/mpeg",
      "sizeBytes": 3145728,
      "blobKey": "blob:asset_full02",
      "proxyBlobKey": null,
      "thumbnailBlobKey": null,
      "waveform": [0.02, 0.35, 0.61, 0.88, 0.42, 0.17],
      "durationMs": 30000,
      "width": null,
      "height": null,
      "frameRate": null,
      "hasAudio": true,
      "videoCodec": null,
      "playable": true,
      "license": {
        "source": "pixabay",
        "name": "CC0",
        "author": "Anonymous",
        "url": "https://pixabay.com/"
      },
      "importedAt": "2026-10-23T00:01:00.000Z"
    },
    "asset_full03": {
      "id": "asset_full03",
      "type": "image",
      "name": "logo.png",
      "sourceType": "local",
      "mimeType": "image/png",
      "sizeBytes": 20480,
      "blobKey": "blob:asset_full03",
      "proxyBlobKey": null,
      "thumbnailBlobKey": null,
      "waveform": null,
      "durationMs": 0,
      "width": 512,
      "height": 512,
      "frameRate": null,
      "hasAudio": false,
      "videoCodec": null,
      "playable": true,
      "license": null,
      "importedAt": "2026-10-23T00:02:00.000Z"
    }
  },
  "tracks": [
    {
      "id": "track_full_v2",
      "type": "video",
      "name": "视频轨 2",
      "order": 0,
      "muted": false,
      "hidden": false,
      "locked": false,
      "height": 64,
      "clips": []
    },
    {
      "id": "track_full_v1",
      "type": "video",
      "name": "视频轨 1",
      "order": 1,
      "muted": false,
      "hidden": false,
      "locked": false,
      "height": 64,
      "clips": [
        {
          "id": "clip_full_c1",
          "assetId": "asset_full01",
          "startMs": 0,
          "durationMs": 12000,
          "inMs": 1000,
          "outMs": 13000,
          "speed": 1,
          "isOverlay": false,
          "zIndex": 0,
          "transform": {
            "x": 0.5,
            "y": 0.5,
            "scale": 1,
            "rotation": 0,
            "opacity": 1,
            "fit": "contain",
            "cornerRadius": 0
          },
          "audio": {
            "muted": false,
            "gain": 1,
            "fadeInMs": 0,
            "fadeOutMs": 0
          },
          "label": null
        },
        {
          "id": "clip_full_c2",
          "assetId": "asset_full03",
          "startMs": 2000,
          "durationMs": 5000,
          "inMs": 0,
          "outMs": 5000,
          "speed": 1,
          "isOverlay": true,
          "zIndex": 1,
          "transform": {
            "x": 0.75,
            "y": 0.25,
            "scale": 0.4,
            "rotation": 0,
            "opacity": 0.9,
            "fit": "contain",
            "cornerRadius": 24
          },
          "audio": {
            "muted": true,
            "gain": 1,
            "fadeInMs": 0,
            "fadeOutMs": 0
          },
          "label": "画中画"
        }
      ]
    },
    {
      "id": "track_full_a1",
      "type": "audio",
      "name": "音频轨 1",
      "order": 2,
      "muted": false,
      "hidden": false,
      "locked": false,
      "height": 56,
      "clips": [
        {
          "id": "clip_full_c3",
          "assetId": "asset_full02",
          "startMs": 0,
          "durationMs": 30000,
          "inMs": 0,
          "outMs": 30000,
          "speed": 1,
          "isOverlay": false,
          "zIndex": 0,
          "transform": {
            "x": 0.5,
            "y": 0.5,
            "scale": 1,
            "rotation": 0,
            "opacity": 1,
            "fit": "contain",
            "cornerRadius": 0
          },
          "audio": {
            "muted": false,
            "gain": 0.8,
            "fadeInMs": 500,
            "fadeOutMs": 500
          },
          "label": null
        }
      ]
    },
    {
      "id": "track_full_t1",
      "type": "text",
      "name": "文字轨",
      "order": 3,
      "muted": false,
      "hidden": false,
      "locked": false,
      "height": 48,
      "clips": [
        {
          "id": "clip_full_c4",
          "assetId": null,
          "startMs": 1000,
          "durationMs": 3000,
          "inMs": 0,
          "outMs": 3000,
          "speed": 1,
          "isOverlay": true,
          "zIndex": 2,
          "transform": {
            "x": 0.5,
            "y": 0.8,
            "scale": 1,
            "rotation": 0,
            "opacity": 1,
            "fit": "contain",
            "cornerRadius": 0
          },
          "text": {
            "content": "第一行\n第二行",
            "fontFamily": "Noto Sans SC",
            "fontSize": 64,
            "fontWeight": 700,
            "fontStyle": "normal",
            "color": "#FFFFFF",
            "strokeColor": "#000000",
            "strokeWidth": 4,
            "backgroundColor": null,
            "lineHeight": 1.3,
            "letterSpacing": 0,
            "align": "center",
            "verticalAlign": "middle"
          },
          "audio": {
            "muted": false,
            "gain": 1,
            "fadeInMs": 0,
            "fadeOutMs": 0
          },
          "label": null
        }
      ]
    }
  ],
  "subtitles": {
    "enabled": true,
    "style": {
      "fontFamily": "Noto Sans SC",
      "fontSize": 48,
      "color": "#FFFFFF",
      "strokeColor": "#000000",
      "strokeWidth": 3,
      "align": "center",
      "bottomOffsetPx": 80
    },
    "cues": [
      {
        "id": "cue_1",
        "startMs": 1000,
        "endMs": 3200,
        "text": "第一句字幕"
      },
      {
        "id": "cue_2",
        "startMs": 3200,
        "endMs": 5600,
        "text": "第二句字幕\n换行保留"
      }
    ]
  },
  "meta": {
    "durationMs": 30000,
    "lastExport": {
      "at": "2026-10-23T01:40:00.000Z",
      "format": "mp4",
      "width": 1920,
      "height": 1080,
      "fps": 30,
      "sizeBytes": 7340032,
      "blobKey": "export:job_20261023_0140"
    }
  }
}
